<?xml version="1.0" encoding="UTF-8"?>
<?xml-stylesheet type="text/xsl" href="universityCatalogueXslt.xsl"?>
<!DOCTYPE universitiesBG SYSTEM "unisInBG.dtd">
<universitiesBG  xmlns:xsi="http://www.w3.org/2001/XMLSchema-instance" xsi:noNamespaceSchemaLocation="universityCatalogueScheme.xsd">
	<universityList>
		<university>
			<universityInfo>
				<name>Софийски университет "Св. Климент Охридски"</name>
				<location>София</location>
				<region>Югозападен регион</region>
				<id>1</id>
				<regionId>0206</regionId>
				<telephone>02/930-8200</telephone>
				<secondTelephone>02/946-0255</secondTelephone>
				<year>1888</year>
				<students>20516</students>
				<img src="su" />
				<webSite href="https://www.uni-sofia.bg/">www.uni-sofia.bg</webSite>
			</universityInfo>
			<facultyList>
				<faculty>Исторически факултет</faculty>
				<faculty>Философски факултет</faculty>
				<faculty>Факултет по класически и нови филологии</faculty>
				<faculty>Факултет по славянски филологии</faculty>
				<faculty>Юридически факултет</faculty>
				<faculty>Факултет по педагогика</faculty>
				<faculty>Факултет по науки за образованието и изкустата</faculty>
				<faculty>Факултет по журналистика и масова комуникация</faculty>
				<faculty>Богословски факултет</faculty>
				<faculty>Стопански факултет</faculty>
				<faculty>Факултет по математика и информатика</faculty>
				<faculty>Физически факултет</faculty>
				<faculty>Факултет по химия и фармация</faculty>
				<faculty>Биологически факултет</faculty>
				<faculty>Геолого-географски факултет</faculty>
				<faculty>Медицински факултет</faculty>
			</facultyList>
		</university>
		<university>
			<universityInfo>
				<name>Технически университет - София</name>
				<location>София</location>
				<region>Югозападен регион</region>
				<id>2</id>
				<regionId>0206</regionId>
				<telephone>02/862-3073</telephone>
				<secondTelephone>02/868-3215</secondTelephone>
				<year>1945</year>
				<students>11005</students>
				<img src="tu" />
				<webSite href="https://tu-sofia.bg/">www.tu-sofia.bg</webSite>
			</universityInfo>
			<facultyList>
				<faculty>Факултет по автоматика</faculty>
				<faculty>Електротехнически факултет</faculty>
				<faculty>Енергомашиностроителен факултет</faculty>
				<faculty>Машинно-технологичен факултет</faculty>
				<faculty>Машиностроителен факултет</faculty>
				<faculty>Факултет по електронна техника и технологии</faculty>
				<faculty>Факултет по телекомуникации</faculty>
				<faculty>Факултет по компютърни системи и технологии</faculty>
				<faculty>Факултет по транспорта</faculty>
				<faculty>Стопански факултет</faculty>
				<faculty>Факултет по приложна математика и информатика</faculty>
				<faculty>Факултет за германско инженерно обучение и промишленост</faculty>
				<faculty>Факултет за френско обучение по електроинженерство</faculty>
				<faculty>Факултет за английско инженерно обучение</faculty>
			</facultyList>
		</university>
		<university>
			<universityInfo>
				<name>Технически университет - София</name>
				<branchName>Филиал Пловдив</branchName>
				<location>Пловдив</location>
				<region>Южен централен регион</region>
				<id>201</id>
				<regionId>0205</regionId>
				<telephone>032/659-565</telephone>
				<year>1986</year>
				<img src="tuP" />
				<webSite href="http://www.tu-plovdiv.bg/">www.tu-plovdiv.bg</webSite>
			</universityInfo>
			<facultyList>
				<faculty>Факултет по електроника и автоматика</faculty>
				<faculty>Факултет по машиностроене и уредостроене</faculty>
			</facultyList>
		</university>
		<university>
			<universityInfo>
				<name>Технически университет - София</name>
				<branchName>Филиал Сливен</branchName>
				<location>Сливен</location>
				<region>Югоизточен регион</region>
				<id>202</id>
				<regionId>0204</regionId>
				<telephone>044/667-709</telephone>
				<secondTelephone>044/667-710</secondTelephone>
				<year>1983</year>
				<img src="tuS" />
				<webSite href="http://www.tu-sliven.com/">www.tu-sliven.com</webSite>
			</universityInfo>
			<facultyList>
				<faculty>Инженерно-педагогически факултет</faculty>
			</facultyList>
		</university>
		<university>
			<universityInfo>
				<name>Национална академия за театрално и филмово изкуство "Кръстьо Сарафов"</name>
				<location>София</location>
				<region>Югозападен регион</region>
				<id>3</id>
				<regionId>0206</regionId>
				<telephone>02/923-1225</telephone>
				<year>1948</year>
				<students>628</students>
				<img src="natfiz" />
				<webSite href="http://natfiz.bg/">www.natfiz.bg</webSite>
			</universityInfo>
			<facultyList>
				<faculty>Факултет "Сценични изкуства"</faculty>
				<faculty>Факултет "Екранни изкуства"</faculty>
			</facultyList>
		</university>
		<university>
			<universityInfo>
				<name>Академия на Министерството на вътрешните работи - София</name>
				<location>София</location>
				<region>Югозападен регион</region>
				<id>4</id>
				<regionId>0206</regionId>
				<telephone>9829250</telephone>
				<secondTelephone>9743785</secondTelephone>
				<year>2002</year>
				<students>1572</students>
				<img src="amvr" />
				<webSite href="https://www.mvr.bg/academy">www.mvr.bg/academy</webSite>
			</universityInfo>
			<facultyList>
				<faculty>Факултет "Полиция"</faculty>
				<faculty>Факултет "Пожрна безопасност и защита на населението"</faculty>
			</facultyList>
		</university>
		<university>
			<universityInfo>
				<name>Висше строително училище "Любен Каравелов" - София</name>
				<location>София</location>
				<region>Югозападен регион</region>
				<id>5</id>
				<regionId>0206</regionId>
				<telephone>8029100</telephone>
				<secondTelephone>8029101</secondTelephone>
				<year>1938</year>
				<students>587</students>
				<img src="vsuLK" />
				<webSite href="https://www.vsu.bg">www.vsu.bg</webSite>
			</universityInfo>
			<facultyList>
				<faculty>Строителен факултет</faculty>
				<faculty>Архитектурен факултет</faculty>
			</facultyList>
		</university>
		<university>
			<universityInfo>
				<name>Висше транспортно училище "Тодор Каблешков" - София</name>
				<location>София</location>
				<region>Югозападен регион</region>
				<id>6</id>
				<regionId>0206</regionId>
				<telephone>9709478</telephone>
				<secondTelephone>970928242</secondTelephone>
				<year>1922</year>
				<students>1466</students>
				<img src="vtu" />
				<webSite href="https://www.vtu.bg">www.vtu.bg</webSite>
			</universityInfo>
			<facultyList>
				<faculty>Факултет Транспортен мениджмънт</faculty>
				<faculty>Факултет Комуникации и електрообзавеждане в транспорта</faculty>
				<faculty>Факултет Техника и строителни технологии в транспорта</faculty>
			</facultyList>
		</university>
		<university>
			<universityInfo>
				<name>Висше училище по застраховане и финанси - София</name>
				<location>София</location>
				<region>Югозападен регион</region>
				<id>7</id>
				<regionId>0206</regionId>
				<telephone>4015811</telephone>
				<year>2000</year>
				<students>1664</students>
				<img src="vuzf" />
				<webSite href="https://www.vuzf.bg">www.vuzf.bg</webSite>
			</universityInfo>
			<facultyList>
				<faculty>Факултет по финанси</faculty>
				<faculty>Факултет по застраховане и осигуряване</faculty>
				<faculty>Факултет по счетоводство и контрол</faculty>
				<faculty>Факултет по маркетинг и мениджмънт</faculty>
			</facultyList>
		</university>
		<university>
			<universityInfo>
				<name>Висше училище по телекомуникации и пощи - София</name>
				<location>София</location>
				<region>Югозападен регион</region>
				<id>8</id>
				<regionId>0206</regionId>
				<telephone>02/862-1034</telephone>
				<secondTelephone>02/806-2227</secondTelephone>
				<year>1923</year>
				<students>1624</students>
				<img src="vutp" />
				<webSite href="https://www.utp.bg">www.utp.bg</webSite>
			</universityInfo>
			<facultyList>
				<faculty>Факултет "Телекомуникации"</faculty>
				<faculty>Факултет "Информационни технологии"</faculty>
				<faculty>Факултет "Мениджмънт в съобщенията"</faculty>
			</facultyList>
		</university>
		<university>
			<universityInfo>
				<name>Военна академия "Георги Стойков Раковски" - София</name>
				<location>София</location>
				<region>Югозападен регион</region>
				<id>9</id>
				<regionId>0206</regionId>
				<telephone>02/922-6500</telephone>
				<secondTelephone>02/944-1657</secondTelephone>
				<year>1912</year>
				<students>1643</students>
				<img src="va" />
				<webSite href="https://rndc.bg">rndc.bg</webSite>
			</universityInfo>
			<facultyList>
				<faculty>Факултет "Национална сигурност и отбрана"</faculty>
				<faculty>Факултет "Командно-щабен"</faculty>
			</facultyList>
		</university>
		<university>
			<universityInfo>
				<name>Лесотехнически университет - София</name>
				<location>София</location>
				<region>Югозападен регион</region>
				<id>10</id>
				<regionId>0206</regionId>
				<telephone>02/962-5997</telephone>
				<secondTelephone>02/868-2830</secondTelephone>
				<year>1953</year>
				<students>2787</students>
				<img src="lu" />
				<webSite href="https://www.ltu.bg">www.ltu.bg</webSite>
			</universityInfo>
			<facultyList>
				<faculty>Факултет "Горско стопанство"</faculty>
				<faculty>Факултет "Горска промишленост"</faculty>
				<faculty>Факултет "Екология и лантшафтна архитектура"</faculty>
				<faculty>Факултет "Стопанско управление"</faculty>
				<faculty>Факултет "Ветеринарна медицина"</faculty>
				<faculty>Агрономически факултет</faculty>
			</facultyList>
		</university>
		<university>
			<universityInfo>
				<name>Медицински университет - София</name>
				<location>София</location>
				<region>Югозападен регион</region>
				<id>11</id>
				<regionId>0206</regionId>